<?xml version="1.0" encoding="UTF-8"?>
<xs:schema xmlns:xs="http://www.w3.org/2001/XMLSchema" elementFormDefault="qualified">
	<xs:element name="drums">
		<xs:complexType>
			<xs:sequence>
				<xs:element ref="key" maxOccurs="unbounded"/>
			</xs:sequence>
		</xs:complexType>
	</xs:element>

	<xs:element name="key">
		<xs:complexType>
			<xs:sequence>
				<xs:element ref="item" minOccurs="0" maxOccurs="unbounded"/>
			</xs:sequence>
		<xs:attribute name="value" use="required" type="keyNumbers"/>
		</xs:complexType>
	</xs:element>

	<xs:element name="item">
		<xs:complexType>
			<xs:attribute name="selectorValue" type="valueType" use="required"/>
			<xs:attribute name="name" type="xs:string" use="required"/>
		</xs:complexType>
	</xs:element>

   <xs:simpleType name="keyNumbers">
		<xs:restriction base="xs:integer">
			<xs:minInclusive value="13"/>
			<xs:maxInclusive value="91"/>
		</xs:restriction>
	</xs:simpleType>

	<xs:simpleType name="valueType">
		<xs:restriction base="xs:string">
			<xs:pattern value="\d+((\.\d+)+)?"/>
		</xs:restriction>
	</xs:simpleType>
</xs:schema>